{
  "Id": "myc_blightcaller_b",
  "Name": "Blightcaller",
  "Description": "",
  "SpriteSource": "druid",
  "Hp": 274,
  "Speed": 15,
  "Energy": 10,
  "EnergyTurn": 0,
  "CardsInHand": 2,
  "ResSlash": 9,
  "ResBlunt": 9,
  "ResPierce": 9,
  "ResFire": -6,
  "ResCold": 19,
  "ResLight": 14,
  "ResMind": 34,
  "ResHoly": -1,
  "ResShadow": 39,
  "AiCards": [
    {
      "CardId": "mycmiasma",
      "Priority": 5,
      "AddCardRound": 0,
      "OnlyCastIf": "Always",
      "ValueCastIf": 0.0,
      "TargetCast": "Random",
      "UnitsInDeck": 1,
      "PercentToCast": 0.0,
      "StartsAtObeliskMadnessLevel": 0,
      "StartsAtSingularityMadnessLevel": 0,
      "AuracurseCastIf": "",
      "SecondOnlyCastIf": "Always",
      "SecondValueCastIf": 0.0
    },
    {
      "CardId": "mycfungalregen",
      "Priority": 6,
      "AddCardRound": 0,
      "OnlyCastIf": "Always",
      "ValueCastIf": 0.6,
      "TargetCast": "LessHealthPercent",
      "UnitsInDeck": 1,
      "PercentToCast": 0.0,
      "StartsAtObeliskMadnessLevel": 0,
      "StartsAtSingularityMadnessLevel": 0,
      "AuracurseCastIf": "",
      "SecondOnlyCastIf": "Always",
      "SecondValueCastIf": 0.0
    }
  ],
  "XpReward": 48,
  "GoldReward": 46,
  "TierReward": 5,
  "IsBoss": false,
  "IsNamed": false,
  "FinishCombatOnDead": false,
  "BigModel": false,
  "Female": false,
  "OnlyKillBossWhenHpZero": false,
  "Difficulty": -1,
  "PreferredPos": "Back",
  "FluffOffsetX": 0.0,
  "FluffOffsetY": 0.0,
  "PosBottom": 0.0,
  "Immunities": [],
  "UpgradedMobId": "",
  "NgPlusMobId": "",
  "HellModeMobId": "",
  "BaseNpcId": "",
  "HpMult": 1.0,
  "SpeedBonus": 0,
  "ResistBonus": 0,
  "TierMob": "T2"
}