{
  "Id": "myc_devourer_plus_b",
  "Name": "Rotmaw Devourer",
  "Description": "",
  "SpriteSource": "swamphorror",
  "Hp": 344,
  "Speed": 16,
  "Energy": 10,
  "EnergyTurn": 0,
  "CardsInHand": 2,
  "ResSlash": 28,
  "ResBlunt": 28,
  "ResPierce": 23,
  "ResFire": 3,
  "ResCold": 18,
  "ResLight": 8,
  "ResMind": 18,
  "ResHoly": 8,
  "ResShadow": 38,
  "AiCards": [
    {
      "CardId": "mycrotmawbitea",
      "Priority": 6,
      "AddCardRound": 0,
      "OnlyCastIf": "Always",
      "ValueCastIf": 0.0,
      "TargetCast": "LessHealthPercent",
      "UnitsInDeck": 1,
      "PercentToCast": 0.0,
      "StartsAtObeliskMadnessLevel": 0,
      "StartsAtSingularityMadnessLevel": 0,
      "AuracurseCastIf": "",
      "SecondOnlyCastIf": "Always",
      "SecondValueCastIf": 0.0
    },
    {
      "CardId": "mycgorgea",
      "Priority": 3,
      "AddCardRound": 2,
      "OnlyCastIf": "Always",
      "ValueCastIf": 0.0,
      "TargetCast": "Random",
      "UnitsInDeck": 1,
      "PercentToCast": 0.0,
      "StartsAtObeliskMadnessLevel": 0,
      "StartsAtSingularityMadnessLevel": 0,
      "AuracurseCastIf": "",
      "SecondOnlyCastIf": "Always",
      "SecondValueCastIf": 0.0
    }
  ],
  "XpReward": 41,
  "GoldReward": 37,
  "TierReward": 4,
  "IsBoss": false,
  "IsNamed": false,
  "FinishCombatOnDead": false,
  "BigModel": false,
  "Difficulty": -1,
  "PreferredPos": "Front",
  "Immunities": [],
  "UpgradedMobId": "",
  "NgPlusMobId": "",
  "HellModeMobId": "",
  "BaseNpcId": "",
  "HpMult": 1.0,
  "SpeedBonus": 0,
  "ResistBonus": 0,
  "TierMob": "T2"
}