{
  "Id": "myc_lurker_b",
  "Name": "Mycelium Lurker",
  "Description": "",
  "SpriteSource": "spider",
  "Hp": 156,
  "Speed": 19,
  "Energy": 10,
  "EnergyTurn": 0,
  "CardsInHand": 2,
  "ResSlash": 9,
  "ResBlunt": 4,
  "ResPierce": 19,
  "ResFire": -6,
  "ResCold": 29,
  "ResLight": -1,
  "ResMind": 29,
  "ResHoly": 9,
  "ResShadow": 24,
  "AiCards": [
    {
      "CardId": "mycrootsnare",
      "Priority": 5,
      "AddCardRound": 0,
      "OnlyCastIf": "Always",
      "ValueCastIf": 0.0,
      "TargetCast": "LessHealthPercent",
      "UnitsInDeck": 1,
      "PercentToCast": 0.0,
      "StartsAtObeliskMadnessLevel": 0,
      "StartsAtSingularityMadnessLevel": 0,
      "AuracurseCastIf": "",
      "SecondOnlyCastIf": "Always",
      "SecondValueCastIf": 0.0
    },
    {
      "CardId": "mycsymbioticdrain",
      "Priority": 4,
      "AddCardRound": 0,
      "OnlyCastIf": "TargetLifeLessThanPercent",
      "ValueCastIf": 0.7,
      "TargetCast": "Random",
      "UnitsInDeck": 1,
      "PercentToCast": 0.0,
      "StartsAtObeliskMadnessLevel": 0,
      "StartsAtSingularityMadnessLevel": 0,
      "AuracurseCastIf": "",
      "SecondOnlyCastIf": "Always",
      "SecondValueCastIf": 0.0
    },
    {
      "CardId": "mycrotbite",
      "Priority": 5,
      "AddCardRound": 1,
      "OnlyCastIf": "Always",
      "ValueCastIf": 0.0,
      "TargetCast": "Random",
      "UnitsInDeck": 1,
      "PercentToCast": 0.0,
      "StartsAtObeliskMadnessLevel": 0,
      "StartsAtSingularityMadnessLevel": 0,
      "AuracurseCastIf": "",
      "SecondOnlyCastIf": "Always",
      "SecondValueCastIf": 0.0
    }
  ],
  "XpReward": 28,
  "GoldReward": 26,
  "TierReward": 4,
  "IsBoss": false,
  "IsNamed": false,
  "FinishCombatOnDead": false,
  "BigModel": false,
  "Difficulty": -1,
  "PreferredPos": "Back",
  "Immunities": [],
  "UpgradedMobId": "",
  "NgPlusMobId": "",
  "HellModeMobId": "",
  "BaseNpcId": "",
  "HpMult": 1.0,
  "SpeedBonus": 0,
  "ResistBonus": 0,
  "TierMob": "T2"
}