{
  "Id": "myc_golem_b",
  "Name": "Mycelium Golem",
  "Description": "",
  "SpriteSource": "trunky",
  "Hp": 313,
  "Speed": 9,
  "Energy": 10,
  "EnergyTurn": 0,
  "CardsInHand": 2,
  "ResSlash": 34,
  "ResBlunt": 39,
  "ResPierce": 24,
  "ResFire": -6,
  "ResCold": 19,
  "ResLight": -1,
  "ResMind": 14,
  "ResHoly": 9,
  "ResShadow": 29,
  "AiCards": [
    {
      "CardId": "myccrushingroot",
      "Priority": 5,
      "AddCardRound": 0,
      "OnlyCastIf": "Always",
      "ValueCastIf": 0.0,
      "TargetCast": "LessHealthPercent",
      "UnitsInDeck": 1,
      "PercentToCast": 0.0,
      "StartsAtObeliskMadnessLevel": 0,
      "StartsAtSingularityMadnessLevel": 0,
      "AuracurseCastIf": "",
      "SecondOnlyCastIf": "Always",
      "SecondValueCastIf": 0.0
    },
    {
      "CardId": "mycbarkshield",
      "Priority": 7,
      "AddCardRound": 0,
      "OnlyCastIf": "TargetHasNotAuraCurse",
      "ValueCastIf": 0.0,
      "TargetCast": "Random",
      "UnitsInDeck": 1,
      "PercentToCast": 0.0,
      "StartsAtObeliskMadnessLevel": 0,
      "StartsAtSingularityMadnessLevel": 0,
      "AuracurseCastIf": "thorns",
      "SecondOnlyCastIf": "Always",
      "SecondValueCastIf": 0.0
    },
    {
      "CardId": "mycsymbioticbloom",
      "Priority": 4,
      "AddCardRound": 2,
      "OnlyCastIf": "Always",
      "ValueCastIf": 0.0,
      "TargetCast": "Random",
      "UnitsInDeck": 1,
      "PercentToCast": 0.0,
      "StartsAtObeliskMadnessLevel": 0,
      "StartsAtSingularityMadnessLevel": 0,
      "AuracurseCastIf": "",
      "SecondOnlyCastIf": "Always",
      "SecondValueCastIf": 0.0
    }
  ],
  "XpReward": 55,
  "GoldReward": 52,
  "TierReward": 5,
  "IsBoss": false,
  "IsNamed": false,
  "FinishCombatOnDead": false,
  "BigModel": true,
  "Difficulty": -1,
  "PreferredPos": "Front",
  "Immunities": [],
  "UpgradedMobId": "",
  "NgPlusMobId": "",
  "HellModeMobId": "",
  "BaseNpcId": "",
  "HpMult": 1.0,
  "SpeedBonus": 0,
  "ResistBonus": 0,
  "TierMob": "T2"
}