{
  "Id": "myc_spitter_plus_b",
  "Name": "Gloom Spitter",
  "Description": "",
  "SpriteSource": "slime",
  "Hp": 184,
  "Speed": 18,
  "Energy": 10,
  "EnergyTurn": 0,
  "CardsInHand": 2,
  "ResSlash": 13,
  "ResBlunt": 18,
  "ResPierce": 8,
  "ResFire": -2,
  "ResCold": 33,
  "ResLight": 18,
  "ResMind": 28,
  "ResHoly": 18,
  "ResShadow": 43,
  "AiCards": [
    {
      "CardId": "mycacidgloba",
      "Priority": 5,
      "AddCardRound": 0,
      "OnlyCastIf": "Always",
      "ValueCastIf": 0.0,
      "TargetCast": "Random",
      "UnitsInDeck": 1,
      "PercentToCast": 0.0,
      "StartsAtObeliskMadnessLevel": 0,
      "StartsAtSingularityMadnessLevel": 0,
      "AuracurseCastIf": "",
      "SecondOnlyCastIf": "Always",
      "SecondValueCastIf": 0.0
    },
    {
      "CardId": "myctoxicpuddlea",
      "Priority": 4,
      "AddCardRound": 0,
      "OnlyCastIf": "Always",
      "ValueCastIf": 0.0,
      "TargetCast": "Random",
      "UnitsInDeck": 1,
      "PercentToCast": 0.0,
      "StartsAtObeliskMadnessLevel": 0,
      "StartsAtSingularityMadnessLevel": 0,
      "AuracurseCastIf": "",
      "SecondOnlyCastIf": "Always",
      "SecondValueCastIf": 0.0
    }
  ],
  "XpReward": 24,
  "GoldReward": 22,
  "TierReward": 4,
  "IsBoss": false,
  "IsNamed": false,
  "FinishCombatOnDead": false,
  "BigModel": false,
  "Difficulty": -1,
  "PreferredPos": "Back",
  "Immunities": [],
  "UpgradedMobId": "",
  "NgPlusMobId": "",
  "HellModeMobId": "",
  "BaseNpcId": "",
  "HpMult": 1.0,
  "SpeedBonus": 0,
  "ResistBonus": 0,
  "TierMob": "T2"
}