{
  "Id": "myc_sproutling",
  "Name": "Sporebloom Sprout",
  "Description": "",
  "SpriteSource": "sapling",
  "Hp": 70,
  "Speed": 17,
  "Energy": 10,
  "EnergyTurn": 0,
  "CardsInHand": 2,
  "ResSlash": 0,
  "ResBlunt": 0,
  "ResPierce": 0,
  "ResFire": -20,
  "ResCold": 0,
  "ResLight": 0,
  "ResMind": 5,
  "ResHoly": -10,
  "ResShadow": 15,
  "AiCards": [
    {
      "CardId": "mycsproutgift",
      "Priority": 6,
      "AddCardRound": 0,
      "OnlyCastIf": "TargetHasNotAuraCurse",
      "ValueCastIf": 0.0,
      "TargetCast": "Random",
      "UnitsInDeck": 1,
      "PercentToCast": 0.0,
      "StartsAtObeliskMadnessLevel": 0,
      "StartsAtSingularityMadnessLevel": 0,
      "AuracurseCastIf": "myc_symbiosis",
      "SecondOnlyCastIf": "Always",
      "SecondValueCastIf": 0.0
    },
    {
      "CardId": "mycsproutlash",
      "Priority": 3,
      "AddCardRound": 0,
      "OnlyCastIf": "Always",
      "ValueCastIf": 0.0,
      "TargetCast": "Random",
      "UnitsInDeck": 1,
      "PercentToCast": 0.0,
      "StartsAtObeliskMadnessLevel": 0,
      "StartsAtSingularityMadnessLevel": 0,
      "AuracurseCastIf": "",
      "SecondOnlyCastIf": "Always",
      "SecondValueCastIf": 0.0
    }
  ],
  "XpReward": 28,
  "GoldReward": 26,
  "TierReward": 3,
  "IsBoss": false,
  "IsNamed": false,
  "FinishCombatOnDead": false,
  "BigModel": false,
  "Difficulty": -1,
  "PreferredPos": "Back",
  "Immunities": [],
  "UpgradedMobId": "myc_sproutling_b",
  "NgPlusMobId": "myc_sproutling_plus",
  "HellModeMobId": "",
  "BaseNpcId": "",
  "HpMult": 1.0,
  "SpeedBonus": 0,
  "ResistBonus": 0,
  "TierMob": "T1"
}