{
  "Id": "myc_mycelarch_plus_b",
  "Name": "The Mycelarch",
  "Description": "",
  "SpriteSource": "elderdryad",
  "Hp": 672,
  "Speed": 16,
  "Energy": 10,
  "EnergyTurn": 0,
  "CardsInHand": 4,
  "ResSlash": 34,
  "ResBlunt": 29,
  "ResPierce": 29,
  "ResFire": -1,
  "ResCold": 34,
  "ResLight": 9,
  "ResMind": 44,
  "ResHoly": 4,
  "ResShadow": 54,
  "AiCards": [
    {
      "CardId": "myctoxicraina",
      "Priority": 5,
      "AddCardRound": 0,
      "OnlyCastIf": "Always",
      "ValueCastIf": 0.0,
      "TargetCast": "Random",
      "UnitsInDeck": 1,
      "PercentToCast": 0.0,
      "StartsAtObeliskMadnessLevel": 0,
      "StartsAtSingularityMadnessLevel": 0,
      "AuracurseCastIf": "",
      "SecondOnlyCastIf": "Always",
      "SecondValueCastIf": 0.0
    },
    {
      "CardId": "mycfungalbarriera",
      "Priority": 6,
      "AddCardRound": 0,
      "OnlyCastIf": "Always",
      "ValueCastIf": 0.0,
      "TargetCast": "Random",
      "UnitsInDeck": 1,
      "PercentToCast": 0.0,
      "StartsAtObeliskMadnessLevel": 0,
      "StartsAtSingularityMadnessLevel": 0,
      "AuracurseCastIf": "",
      "SecondOnlyCastIf": "Always",
      "SecondValueCastIf": 0.0
    },
    {
      "CardId": "mycsporevolleya",
      "Priority": 4,
      "AddCardRound": 0,
      "OnlyCastIf": "Always",
      "ValueCastIf": 0.0,
      "TargetCast": "Random",
      "UnitsInDeck": 1,
      "PercentToCast": 0.0,
      "StartsAtObeliskMadnessLevel": 0,
      "StartsAtSingularityMadnessLevel": 0,
      "AuracurseCastIf": "",
      "SecondOnlyCastIf": "Always",
      "SecondValueCastIf": 0.0
    },
    {
      "CardId": "mycsporespawna",
      "Priority": 3,
      "AddCardRound": 1,
      "OnlyCastIf": "Always",
      "ValueCastIf": 3.0,
      "TargetCast": "Random",
      "UnitsInDeck": 1,
      "PercentToCast": 0.0,
      "StartsAtObeliskMadnessLevel": 0,
      "StartsAtSingularityMadnessLevel": 0,
      "AuracurseCastIf": "",
      "SecondOnlyCastIf": "Always",
      "SecondValueCastIf": 0.0
    },
    {
      "CardId": "mychallucinobursta",
      "Priority": 7,
      "AddCardRound": 3,
      "OnlyCastIf": "Always",
      "ValueCastIf": 0.0,
      "TargetCast": "Random",
      "UnitsInDeck": 1,
      "PercentToCast": 0.0,
      "StartsAtObeliskMadnessLevel": 0,
      "StartsAtSingularityMadnessLevel": 0,
      "AuracurseCastIf": "",
      "SecondOnlyCastIf": "Always",
      "SecondValueCastIf": 0.0
    },
    {
      "CardId": "mycpandemica",
      "Priority": 6,
      "AddCardRound": 3,
      "OnlyCastIf": "Always",
      "ValueCastIf": 0.0,
      "TargetCast": "MoreHealthPercent",
      "UnitsInDeck": 1,
      "PercentToCast": 0.0,
      "StartsAtObeliskMadnessLevel": 0,
      "StartsAtSingularityMadnessLevel": 0,
      "AuracurseCastIf": "",
      "SecondOnlyCastIf": "Always",
      "SecondValueCastIf": 0.0
    },
    {
      "CardId": "mycneurallinka",
      "Priority": 8,
      "AddCardRound": 3,
      "OnlyCastIf": "TargetHasNotAuraCurse",
      "ValueCastIf": 0.0,
      "TargetCast": "Random",
      "UnitsInDeck": 1,
      "PercentToCast": 0.0,
      "StartsAtObeliskMadnessLevel": 0,
      "StartsAtSingularityMadnessLevel": 0,
      "AuracurseCastIf": "powerful",
      "SecondOnlyCastIf": "Always",
      "SecondValueCastIf": 0.0
    },
    {
      "CardId": "mycmyceliumapoca",
      "Priority": 9,
      "AddCardRound": 6,
      "OnlyCastIf": "Always",
      "ValueCastIf": 0.0,
      "TargetCast": "Random",
      "UnitsInDeck": 1,
      "PercentToCast": 0.0,
      "StartsAtObeliskMadnessLevel": 0,
      "StartsAtSingularityMadnessLevel": 0,
      "AuracurseCastIf": "",
      "SecondOnlyCastIf": "Always",
      "SecondValueCastIf": 0.0
    }
  ],
  "XpReward": 170,
  "GoldReward": 140,
  "TierReward": 9,
  "IsBoss": true,
  "IsNamed": false,
  "FinishCombatOnDead": true,
  "BigModel": true,
  "Difficulty": -1,
  "PreferredPos": "Front",
  "Immunities": [
    "paralyze",
    "sleep",
    "doom"
  ],
  "UpgradedMobId": "",
  "NgPlusMobId": "",
  "HellModeMobId": "",
  "BaseNpcId": "",
  "HpMult": 1.0,
  "SpeedBonus": 0,
  "ResistBonus": 0,
  "TierMob": "T2"
}