{
  "Id": "myc_shambler_plus",
  "Name": "Sporecap Shambler",
  "Description": "",
  "SpriteSource": "treant",
  "Hp": 147,
  "Speed": 11,
  "Energy": 10,
  "EnergyTurn": 0,
  "CardsInHand": 2,
  "ResSlash": 19,
  "ResBlunt": 24,
  "ResPierce": 14,
  "ResFire": -11,
  "ResCold": 19,
  "ResLight": 9,
  "ResMind": 24,
  "ResHoly": -6,
  "ResShadow": 34,
  "AiCards": [
    {
      "CardId": "myctoxicslama",
      "Priority": 5,
      "AddCardRound": 0,
      "OnlyCastIf": "Always",
      "ValueCastIf": 0.0,
      "TargetCast": "Random",
      "UnitsInDeck": 1,
      "PercentToCast": 0.0,
      "StartsAtObeliskMadnessLevel": 0,
      "StartsAtSingularityMadnessLevel": 0,
      "AuracurseCastIf": "",
      "SecondOnlyCastIf": "Always",
      "SecondValueCastIf": 0.0
    },
    {
      "CardId": "mycsporemista",
      "Priority": 3,
      "AddCardRound": 0,
      "OnlyCastIf": "Always",
      "ValueCastIf": 0.0,
      "TargetCast": "Random",
      "UnitsInDeck": 1,
      "PercentToCast": 0.0,
      "StartsAtObeliskMadnessLevel": 0,
      "StartsAtSingularityMadnessLevel": 0,
      "AuracurseCastIf": "",
      "SecondOnlyCastIf": "Always",
      "SecondValueCastIf": 0.0
    }
  ],
  "XpReward": 28,
  "GoldReward": 26,
  "TierReward": 4,
  "IsBoss": false,
  "IsNamed": false,
  "FinishCombatOnDead": false,
  "BigModel": false,
  "Difficulty": -1,
  "PreferredPos": "Front",
  "Immunities": [],
  "UpgradedMobId": "myc_shambler_plus_b",
  "NgPlusMobId": "",
  "HellModeMobId": "",
  "BaseNpcId": "",
  "HpMult": 1.0,
  "SpeedBonus": 0,
  "ResistBonus": 0,
  "TierMob": "T1"
}