{
  "Id": "myc_thrall",
  "Name": "Cordyceps Thrall",
  "Description": "",
  "SpriteSource": "bonefighter",
  "Hp": 126,
  "Speed": 12,
  "Energy": 10,
  "EnergyTurn": 0,
  "CardsInHand": 2,
  "ResSlash": 15,
  "ResBlunt": 20,
  "ResPierce": 5,
  "ResFire": 5,
  "ResCold": 0,
  "ResLight": -15,
  "ResMind": -10,
  "ResHoly": -20,
  "ResShadow": 15,
  "AiCards": [
    {
      "CardId": "mycmindlesscharge",
      "Priority": 6,
      "AddCardRound": 0,
      "OnlyCastIf": "Always",
      "ValueCastIf": 0.0,
      "TargetCast": "LessHealthPercent",
      "UnitsInDeck": 1,
      "PercentToCast": 0.0,
      "StartsAtObeliskMadnessLevel": 0,
      "StartsAtSingularityMadnessLevel": 0,
      "AuracurseCastIf": "",
      "SecondOnlyCastIf": "Always",
      "SecondValueCastIf": 0.0
    },
    {
      "CardId": "mycfungalburst",
      "Priority": 3,
      "AddCardRound": 2,
      "OnlyCastIf": "Always",
      "ValueCastIf": 3.0,
      "TargetCast": "Random",
      "UnitsInDeck": 1,
      "PercentToCast": 0.0,
      "StartsAtObeliskMadnessLevel": 0,
      "StartsAtSingularityMadnessLevel": 0,
      "AuracurseCastIf": "",
      "SecondOnlyCastIf": "Always",
      "SecondValueCastIf": 0.0
    }
  ],
  "XpReward": 33,
  "GoldReward": 30,
  "TierReward": 3,
  "IsBoss": false,
  "IsNamed": false,
  "FinishCombatOnDead": false,
  "BigModel": false,
  "Difficulty": -1,
  "PreferredPos": "Front",
  "Immunities": [],
  "UpgradedMobId": "myc_thrall_b",
  "NgPlusMobId": "myc_thrall_plus",
  "HellModeMobId": "",
  "BaseNpcId": "",
  "HpMult": 1.0,
  "SpeedBonus": 0,
  "ResistBonus": 0,
  "TierMob": "T1"
}