{
  "Id": "myc_mycelarch",
  "Name": "The Mycelarch",
  "Description": "",
  "SpriteSource": "elderdryad",
  "Hp": 420,
  "Speed": 14,
  "Energy": 10,
  "EnergyTurn": 0,
  "CardsInHand": 4,
  "ResSlash": 15,
  "ResBlunt": 10,
  "ResPierce": 10,
  "ResFire": -20,
  "ResCold": 15,
  "ResLight": -10,
  "ResMind": 25,
  "ResHoly": -15,
  "ResShadow": 35,
  "AiCards": [
    {
      "CardId": "myctoxicrain",
      "Priority": 5,
      "AddCardRound": 0,
      "OnlyCastIf": "Always",
      "ValueCastIf": 0.0,
      "TargetCast": "Random",
      "UnitsInDeck": 1,
      "PercentToCast": 0.0,
      "StartsAtObeliskMadnessLevel": 0,
      "StartsAtSingularityMadnessLevel": 0,
      "AuracurseCastIf": "",
      "SecondOnlyCastIf": "Always",
      "SecondValueCastIf": 0.0
    },
    {
      "CardId": "mycfungalbarrier",
      "Priority": 6,
      "AddCardRound": 0,
      "OnlyCastIf": "Always",
      "ValueCastIf": 0.0,
      "TargetCast": "Random",
      "UnitsInDeck": 1,
      "PercentToCast": 0.0,
      "StartsAtObeliskMadnessLevel": 0,
      "StartsAtSingularityMadnessLevel": 0,
      "AuracurseCastIf": "",
      "SecondOnlyCastIf": "Always",
      "SecondValueCastIf": 0.0
    },
    {
      "CardId": "mycsporevolley",
      "Priority": 4,
      "AddCardRound": 0,
      "OnlyCastIf": "Always",
      "ValueCastIf": 0.0,
      "TargetCast": "Random",
      "UnitsInDeck": 1,
      "PercentToCast": 0.0,
      "StartsAtObeliskMadnessLevel": 0,
      "StartsAtSingularityMadnessLevel": 0,
      "AuracurseCastIf": "",
      "SecondOnlyCastIf": "Always",
      "SecondValueCastIf": 0.0
    },
    {
      "CardId": "mycsporespawn",
      "Priority": 3,
      "AddCardRound": 1,
      "OnlyCastIf": "Always",
      "ValueCastIf": 3.0,
      "TargetCast": "Random",
      "UnitsInDeck": 1,
      "PercentToCast": 0.0,
      "StartsAtObeliskMadnessLevel": 0,
      "StartsAtSingularityMadnessLevel": 0,
      "AuracurseCastIf": "",
      "SecondOnlyCastIf": "Always",
      "SecondValueCastIf": 0.0
    },
    {
      "CardId": "mychallucinoburst",
      "Priority": 7,
      "AddCardRound": 3,
      "OnlyCastIf": "Always",
      "ValueCastIf": 0.0,
      "TargetCast": "Random",
      "UnitsInDeck": 1,
      "PercentToCast": 0.0,
      "StartsAtObeliskMadnessLevel": 0,
      "StartsAtSingularityMadnessLevel": 0,
      "AuracurseCastIf": "",
      "SecondOnlyCastIf": "Always",
      "SecondValueCastIf": 0.0
    },
    {
      "CardId": "mycpandemic",
      "Priority": 6,
      "AddCardRound": 3,
      "OnlyCastIf": "Always",
      "ValueCastIf": 0.0,
      "TargetCast": "MoreHealthPercent",
      "UnitsInDeck": 1,
      "PercentToCast": 0.0,
      "StartsAtObeliskMadnessLevel": 0,
      "StartsAtSingularityMadnessLevel": 0,
      "AuracurseCastIf": "",
      "SecondOnlyCastIf": "Always",
      "SecondValueCastIf": 0.0
    },
    {
      "CardId": "mycneurallink",
      "Priority": 8,
      "AddCardRound": 3,
      "OnlyCastIf": "TargetHasNotAuraCurse",
      "ValueCastIf": 0.0,
      "TargetCast": "Random",
      "UnitsInDeck": 1,
      "PercentToCast": 0.0,
      "StartsAtObeliskMadnessLevel": 0,
      "StartsAtSingularityMadnessLevel": 0,
      "AuracurseCastIf": "powerful",
      "SecondOnlyCastIf": "Always",
      "SecondValueCastIf": 0.0
    },
    {
      "CardId": "mycmyceliumapoc",
      "Priority": 9,
      "AddCardRound": 6,
      "OnlyCastIf": "Always",
      "ValueCastIf": 0.0,
      "TargetCast": "Random",
      "UnitsInDeck": 1,
      "PercentToCast": 0.0,
      "StartsAtObeliskMadnessLevel": 0,
      "StartsAtSingularityMadnessLevel": 0,
      "AuracurseCastIf": "",
      "SecondOnlyCastIf": "Always",
      "SecondValueCastIf": 0.0
    }
  ],
  "XpReward": 120,
  "GoldReward": 120,
  "TierReward": 7,
  "IsBoss": true,
  "IsNamed": false,
  "FinishCombatOnDead": true,
  "BigModel": true,
  "Female": false,
  "OnlyKillBossWhenHpZero": false,
  "Difficulty": -1,
  "PreferredPos": "Front",
  "FluffOffsetX": 0.0,
  "FluffOffsetY": 0.0,
  "PosBottom": 0.0,
  "Immunities": [
    "paralyze",
    "sleep",
    "doom"
  ],
  "UpgradedMobId": "myc_mycelarch_b",
  "NgPlusMobId": "myc_mycelarch_plus",
  "HellModeMobId": "",
  "BaseNpcId": "",
  "HpMult": 1.0,
  "SpeedBonus": 0,
  "ResistBonus": 0,
  "TierMob": "T1"
}